Producto,Precio
Paraguas transparente empuñadura blanca 98 cm de diámetro automáticoVendedor excelente Plus,12.9
PARAGUAS UNISEX 96 CM 8 RIBS O PLIEGUES RESISTENTE IMPERMEABLE PLEGABLE LLUVIAVendedor excelente Plus,6.95
Paraguas a prueba de viento Wonderdry,12.9
Paraguas Caballero Anti Viento 96cm Automatico 8 Varillas Negro Radio 70cm,10
Paraguas Manual Poe Lol,7.95
"PARAGUAS HARRY POTTER PLEGABLE MANUAL, by cerda",14
Paraguas Caballero 56cm Plegable Manual 100d Radio 49cm,6.92
"Paraguas Automatico extra grande de Diámetro 130 cm, cierre de velcro, unisexVendedor excelente Plus",15.5
Paraguas Reversible,11.99
Paraguas Plegables Negro Con Mango De Madera Para Hombre,22.95
Paraguas mini automático negro Perletti,17.5
Paraguas Compacto y Resistente al Viento - Paraguas Plegable,19.99
Paraguas infantil largo automatico transparente Lol Surprise,19.5
Mountain Warehouse Paraguas mini,17.99
Paraguas transparente de copa mango blanco automáticoVendedor excelente Plus,12.9
Paraguas Bolsillo Automático con Mango a Prueba de Viento Gris,41.71
Fantástico Paraguas Xiaom. Reflectante plegable automático.Máx.Calidad. OFERTA!,21.5
Paraguas automatico trasparente de copa  Vendedor excelente Plus,12.9
Mountain Warehouse Paraguas Walking: liso,19.99
Paraguas FC Barcelona 64125Vendedor excelente Plus,19.99
"Paraguas AVK de hombre, mujer, resistente al viento, plegable. automático",24.99
Paraguas FC Barcelona 64123Vendedor excelente Plus,24.99
Incognito Perro Scottie Patrón Compacto Paraguas Plegable,11.7
Paraguas Automatico Mini 95d 42-56cm Negro,9.13
Paraguas plegable,5.99
Paraguas Negro Auto Abierto Cierre Compacto Plegable Prueba de Viento 10CostillaVendedor excelente Plus,13.99
Paraguas FC BarcelonaVendedor excelente Plus,10.99
Nuevo Londres Union Jack Ligero Paraguas En Rojo y Azul ✔ ✔ Shine Umbrella,7.13
"Paraguas de lluvia para mujer, con bolsillo, para viajes",NA
"Paraguas para hombre y mujer, sombrilla de doble capa resistente a la lluvia",17.12
PARAGUAS PLEGABLE JBM,10
Baldinini Paraguas Lluvia Clásico Grande Art. BALD30 Diámetro CM 100,59
Batman - Paraguas,19.94
Paraguas transparente con mango blanco 98 cm de diámetroVendedor excelente Plus,12.9
Paraguas FC Barcelona 64124Vendedor excelente Plus,11.99
"OLYCAT Paraguas plegable automático para mujer, sombrilla resistente lluvia",22.1
Paraguas AVK compacto y resistente al viento plegable totalmente automático,14.99
Paraguas Manual Plegable Avengers,14.75
"Paraguas Plegable Automatico, Paraguas Con Luz Led,Antiviento,Ligero, Viajes",17.9
"Mountain Warehouse Miniparaguas estampado - Paraguas pequeño, compacto",12.99
Paraguas Manual Poe Mickey,10.75
BREE Paraguas Havanna Umbrella Black Negro,28.57
Paraguas AVK para mujer hombre unisex clásico totalmente automático  plegable ,24.99
Paraguas Manual Poe Spiderman,10.75
Grande Brillante Paraguas Arcoiris Colorido Paraguas para Lluvia 74cm,22.76
Paraguas FC BarcelonaVendedor excelente Plus,10.99
ELEGANTE PARAGUAS  DE HOMBRE PLEGABLE TAMAÑO GRANDE MARCA EZPELETA.COLOR NEGRO.,24.95
Mountain Warehouse Paraguas mini con estampado de lunares,17.99
Drizzles Negro Paraguas Automático UU95,5.94
bugatti Paraguas Doorman Uni Black Negro,74.95
Paraguas Plegable Automático Paraguas Impermeable de (compact|negro 1),21.99
Paraguas para mujer o hombre unisex automatico resistente al viento muy ligero,24.99
Newdora Paraguas Plegable Automatico Negro Impermeable 10 Armazon,19
Mountain Warehouse Paraguas Classic: liso,19.99
"Paraguas Automatico inversa con Led a prueba de viento , 3 Colores",25.88
"Bestico Paraguas Compacto y Resistente al Viento, Paraguas Plegable con",21.75
paraguas Reforzadas Apertura Automático 10Varillas con colgador cristal plegableVendedor excelente Plus,14.99
Paraguas plegable de apertura y cierre automático Paraguas ligero impermeable a,NA
